{
  "schema": "https://debz.dev/schema/legacy-compatibility-policy-v1",
  "version": 1,
  "issue": 86,
  "current_release_mode": "legacy_capable",
  "legacy_capable_release_range": ">=0.3.0,<0.4.0",
  "native_only_cutover_ready": false,
  "invariants": {
    "legacy_is_never_native_authority": true,
    "active_legacy_requires_legacy_capable_recovery": true,
    "native_only_must_not_clear_active_legacy": true,
    "completed_history_is_read_only": true,
    "historical_bytes_are_never_rewritten": true,
    "no_fallback_after_native_mutation": true,
    "no_success_shaped_default": true,
    "single_root_operation_namespace": true
  },
  "artifact_policy": [
    {
      "schema": "https://debz.dev/schema/system-profile-v1",
      "versions": [1],
      "backend": "legacy_dpkg",
      "new_execution": "deprecated_but_available",
      "active_recovery": "legacy_capable_release_required",
      "completed_history": "exact_bytes_read_only"
    },
    {
      "schema": "https://debz.dev/schema/system-profile-v2",
      "versions": [2],
      "backend": "explicit",
      "new_execution": "selected_backend_only",
      "active_recovery": "selected_backend_only",
      "completed_history": "exact_bytes_read_only"
    },
    {
      "schema": "https://debz.dev/schema/exact-closure-lock-v1",
      "versions": [1],
      "backend": "legacy_dpkg",
      "new_execution": "deprecated_but_available",
      "active_recovery": "legacy_capable_release_required",
      "completed_history": "canonical_digest_read_only"
    },
    {
      "schema": "https://debz.dev/schema/exact-closure-lock-v2",
      "versions": [2],
      "backend": "explicit_context",
      "new_execution": "selected_backend_only",
      "active_recovery": "recorded_backend_only",
      "completed_history": "canonical_digest_read_only"
    },
    {
      "schema": "https://debz.dev/schema/transaction-result-v1",
      "versions": [1],
      "backend": "legacy_dpkg",
      "new_execution": "deprecated_but_available",
      "active_recovery": "legacy_capable_release_required",
      "completed_history": "canonical_digest_read_only"
    },
    {
      "schema": "https://debz.dev/schema/transaction-result-v2",
      "versions": [2],
      "backend": "legacy_dpkg",
      "new_execution": "deprecated_but_available",
      "active_recovery": "legacy_capable_release_required",
      "completed_history": "canonical_digest_read_only"
    },
    {
      "schema": "io.github.cataggar.debz.transaction-result-summary.v1",
      "versions": [1],
      "backend": "legacy_dpkg",
      "new_execution": "deprecated_but_available",
      "active_recovery": "not_applicable",
      "completed_history": "exact_contract_read_only"
    },
    {
      "schema": "io.github.cataggar.debz.transaction-result-summary.v2",
      "versions": [2],
      "backend": "native",
      "new_execution": "native_only",
      "active_recovery": "not_applicable",
      "completed_history": "exact_contract_read_only"
    },
    {
      "schema": "io.github.cataggar.debz.transaction-result-capability.v1",
      "versions": [1],
      "backend": "native",
      "new_execution": "native_only",
      "active_recovery": "not_applicable",
      "completed_history": "exact_contract_read_only"
    },
    {
      "schema": "debz:transaction-journal",
      "versions": [1, 2, 3, 4],
      "backend": "legacy_dpkg",
      "new_execution": "version_4_only",
      "active_recovery": "legacy_capable_release_required",
      "completed_history": "checksummed_exact_bytes_read_only"
    },
    {
      "schema": "https://debz.dev/schema/root-operation-record-v1",
      "versions": [1],
      "backend": "explicit",
      "new_execution": "selected_backend_only",
      "active_recovery": "recorded_backend_only",
      "completed_history": "canonical_digest_read_only"
    },
    {
      "schema": "https://debz.dev/schema/root-operation-completion-v1",
      "versions": [1],
      "backend": "explicit",
      "new_execution": "selected_backend_only",
      "active_recovery": "recorded_backend_only",
      "completed_history": "canonical_digest_read_only"
    },
    {
      "schema": "https://debz.dev/schema/apt-system-operation-state-v1",
      "versions": [1],
      "backend": "explicit_context",
      "new_execution": "selected_backend_only",
      "active_recovery": "original_profile_and_backend_only",
      "completed_history": "canonical_digest_read_only"
    },
    {
      "schema": "https://debz.dev/schema/apt-system-result-v1",
      "versions": [1],
      "backend": "explicit_context",
      "new_execution": "selected_backend_only",
      "active_recovery": "original_profile_and_backend_only",
      "completed_history": "canonical_digest_read_only"
    },
    {
      "schema": "https://debz.dev/schema/apt-system-result-v2",
      "versions": [2],
      "backend": "explicit_context",
      "new_execution": "selected_backend_only",
      "active_recovery": "original_profile_and_backend_only",
      "completed_history": "canonical_digest_read_only"
    },
    {
      "schema": "https://debz.dev/schema/apt-system-result-v3",
      "versions": [3],
      "backend": "explicit_context",
      "new_execution": "selected_backend_only",
      "active_recovery": "original_profile_and_backend_only",
      "completed_history": "canonical_digest_read_only"
    },
    {
      "schema": "https://debz.dev/schema/apt-system-execution-completion-v1",
      "versions": [1],
      "backend": "native",
      "new_execution": "native_only",
      "active_recovery": "native_only",
      "completed_history": "canonical_digest_read_only"
    },
    {
      "schema": "io.github.cataggar.debz.command.v1",
      "versions": [1],
      "backend": "explicit",
      "new_execution": "selected_backend_only",
      "active_recovery": "not_applicable",
      "completed_history": "exact_contract_read_only"
    },
    {
      "schema": "https://debz.dev/schema/repository-add-state-v1",
      "versions": [1],
      "backend": "explicit",
      "new_execution": "selected_backend_only",
      "active_recovery": "recorded_backend_only",
      "completed_history": "canonical_digest_read_only"
    },
    {
      "schema": "https://debz.dev/schema/repository-operation-result-v1",
      "versions": [1],
      "backend": "explicit",
      "new_execution": "selected_backend_only",
      "active_recovery": "recorded_backend_only",
      "completed_history": "canonical_digest_read_only"
    },
    {
      "schema": "io.github.cataggar.debz.package-cache-fingerprint.v1",
      "versions": [1],
      "backend": "legacy_dpkg",
      "new_execution": "deprecated_but_available",
      "active_recovery": "not_applicable",
      "completed_history": "exact_contract_read_only"
    },
    {
      "schema": "io.github.cataggar.debz.package-cache-fingerprint.v2",
      "versions": [2],
      "backend": "native",
      "new_execution": "native_only",
      "active_recovery": "not_applicable",
      "completed_history": "exact_contract_read_only"
    },
    {
      "schema": "io.github.cataggar.debz.package-cache-result.v1",
      "versions": [1],
      "backend": "legacy_dpkg",
      "new_execution": "deprecated_but_available",
      "active_recovery": "not_applicable",
      "completed_history": "exact_contract_read_only"
    },
    {
      "schema": "io.github.cataggar.debz.package-cache-result.v2",
      "versions": [2],
      "backend": "native",
      "new_execution": "native_only",
      "active_recovery": "not_applicable",
      "completed_history": "exact_contract_read_only"
    },
    {
      "schema": "io.github.cataggar.debz.package-cache-error.v1",
      "versions": [1],
      "backend": "explicit",
      "new_execution": "selected_backend_only",
      "active_recovery": "not_applicable",
      "completed_history": "exact_contract_read_only"
    },
    {
      "schema": "io.github.cataggar.debz.package-family.capabilities.v1",
      "versions": [1],
      "backend": "legacy_dpkg",
      "new_execution": "deprecated_but_available",
      "active_recovery": "not_applicable",
      "completed_history": "exact_contract_read_only"
    },
    {
      "schema": "io.github.cataggar.debz.package-family.capabilities.v2",
      "versions": [2],
      "backend": "native",
      "new_execution": "native_only",
      "active_recovery": "not_applicable",
      "completed_history": "exact_contract_read_only"
    },
    {
      "schema": "io.github.cataggar.debz.package-family.request.v1",
      "versions": [1],
      "backend": "legacy_dpkg",
      "new_execution": "deprecated_but_available",
      "active_recovery": "not_applicable",
      "completed_history": "exact_contract_read_only"
    },
    {
      "schema": "io.github.cataggar.debz.package-family.request.v2",
      "versions": [2],
      "backend": "native",
      "new_execution": "native_only",
      "active_recovery": "not_applicable",
      "completed_history": "exact_contract_read_only"
    },
    {
      "schema": "io.github.cataggar.debz.package-family.result.v1",
      "versions": [1],
      "backend": "legacy_dpkg",
      "new_execution": "deprecated_but_available",
      "active_recovery": "not_applicable",
      "completed_history": "exact_contract_read_only"
    },
    {
      "schema": "io.github.cataggar.debz.package-family.result.v2",
      "versions": [2],
      "backend": "native",
      "new_execution": "native_only",
      "active_recovery": "not_applicable",
      "completed_history": "exact_contract_read_only"
    },
    {
      "schema": "https://debz.dev/schema/native-transaction-provenance-v1",
      "versions": [1],
      "backend": "native",
      "new_execution": "native_only",
      "active_recovery": "native_only",
      "completed_history": "canonical_digest_read_only"
    },
    {
      "schema": "io.github.cataggar.debz.native-install-capability.v1",
      "versions": [1],
      "backend": "native",
      "new_execution": "native_only",
      "active_recovery": "not_applicable",